<?xml version="1.0" encoding="utf-8"?>

<CV xmlns:xsi="http://www.w3.org/2001/XMLSchema-instance"
    xsi:noNamespaceSchemaLocation="portefolio.xsd">
  <PersonalInfo>
    <Name image="moi.jpg" >BASSETTE Arthur</Name>
    <Phone>+33 7 83 05 50 12</Phone>
    <Email>arthur.chancereul@gmail.com</Email>
    <InternshipSearch>
      <Duration>
        <Lang id="en">8 weeks</Lang>
        <Lang id="fr">8 semaines</Lang>
        <Lang id="zh">8周</Lang>
      </Duration>
      <Period>
        <Lang id="en">March - July 2026</Lang>
        <Lang id="fr">Mars - Juillet 2026</Lang>
        <Lang id="zh">2026年3月至7月</Lang>
      </Period>
    </InternshipSearch>
  </PersonalInfo>
  

  <ProfessionalSummary>
    <Text>
      <Lang id="en">Computer Science engineering student (second year) at Sup Galilée, currently in a work-study program as an Assistant Project Manager specializing in Business Intelligence (BI) at Institut Catholique de Paris. Passionate about data analytics, software development, and project management. Strong problem-solving skills and experience with BI tools, programming, and data visualization.</Lang>
      <Lang id="fr">Étudiant en 2e année d'ingénierie informatique à Sup Galilée, actuellement en alternance comme  assistant chef de projet en Business Intelligence (BI) à l’Institut Catholique de Paris. Passionné par l’analyse de données, le développement logiciel et la gestion de projet. Fortes compétences en résolution de problèmes et expérience avec les outils BI, la programmation et la visualisation de données.</Lang>
      <Lang id="zh">Sup Galilée计算机工程系二年级学生，目前在巴黎天主教学院担任商务智能（BI）项目助理，采用学徒制培养方式。热衷于数据分析、软件开发和项目管理，具备扎实的问题解决能力和丰富的BI工具、编程与数据可视化经验。</Lang>
    </Text>
  </ProfessionalSummary>

  <Education>
    <Degree>
      <Title>
        <Lang id="en">Engineering Degree in Computer Science</Lang>
        <Lang id="fr">Diplôme d’ingénieur en Informatique</Lang>
        <Lang id="zh">计算机工程学位</Lang>
      </Title>
      <Institution>
        <Lang id="en">Sup Galilée, Université Sorbonne Paris Nord</Lang>
        <Lang id="fr">Sup Galilée, Université Sorbonne Paris Nord</Lang>
        <Lang id="zh">巴黎北索邦大学 Sup Galilée</Lang>
      </Institution>
      <Type>
        <Lang id="en">Apprenticeship</Lang>
        <Lang id="fr">Alternance</Lang>
        <Lang id="zh">学徒制</Lang>
      </Type>
      <Years>2023 – Present</Years>
    </Degree>

    <Degree>
      <Title>
        <Lang id="en">Bachelor’s Degree in Computer Science (L3)</Lang>
        <Lang id="fr">Licence 3 Informatique</Lang>
        <Lang id="zh">计算机科学学士（L3）</Lang>
      </Title>
      <Institution>
        <Lang id="en">Institut Galilée, Université Sorbonne Paris Nord</Lang>
        <Lang id="fr">Institut Galilée, Université Sorbonne Paris Nord</Lang>
        <Lang id="zh">巴黎北索邦大学 Galilée学院</Lang>
      </Institution>
      <Years>2022 – 2023</Years>
    </Degree>

    <Degree>
      <Title>
        <Lang id="en">Two-Year Preparatory Program for Engineering School (CP2I)</Lang>
        <Lang id="fr">Classe Préparatoire  Ingénieur Intégrée (CP2I)</Lang>
        <Lang id="zh">工程学院预科项目（CPGE）</Lang>
      </Title>
      <Institution>
        <Lang id="en">Sup Galilée, Université Sorbonne Paris Nord</Lang>
        <Lang id="fr">Sup Galilée, Université Sorbonne Paris Nord</Lang>
        <Lang id="zh">巴黎北索邦大学 Sup Galilée</Lang>
      </Institution>
      <Years>2020 – 2022</Years>
    </Degree>
  </Education>

  <WorkExperience>
    <Job>
      <Title>
        <Lang id="en">Assistant Project Manager – Business Intelligence</Lang>
        <Lang id="fr">Assistant chef de projet – Business Intelligence</Lang>
        <Lang id="zh">商务智能助理项目经理</Lang>
      </Title>
      <Company>Institut Catholique de Paris</Company>
      <Years>2023 – Present</Years>
      <Responsibilities>
        <Task>
          <Lang id="en">Assisting in the implementation and optimization of BI solutions to support strategic decision-making.</Lang>
          <Lang id="fr">Participer à la mise en œuvre et à l’optimisation de solutions BI pour soutenir les décisions stratégiques.</Lang>
          <Lang id="zh">协助实施和优化BI解决方案，以支持战略决策。</Lang>
        </Task>
        <Task>
          <Lang id="en">Extracting, transforming, and visualizing data using BI tools.</Lang>
          <Lang id="fr">Extraire, transformer et visualiser des données à l’aide d’outils BI.</Lang>
          <Lang id="zh">使用BI工具提取、转换并可视化数据。</Lang>
        </Task>
        <Task>
          <Lang id="en">Collaborating with stakeholders to define reporting needs and improve data-driven processes.</Lang>
          <Lang id="fr">Collaborer avec les parties prenantes pour définir les besoins de reporting et améliorer les processus pilotés par les données.</Lang>
          <Lang id="zh">与利益相关者协作，定义报告需求并优化数据驱动流程。</Lang>
        </Task>
        <Task>
          <Lang id="en">Participating in project planning, documentation, and follow-ups.</Lang>
          <Lang id="fr">Participer à la planification de projet, à la documentation et au suivi.</Lang>
          <Lang id="zh">参与项目计划、文档编写和后续跟进。</Lang>
        </Task>
        <Task>
          <Lang id="en">Around 10,000 students, 1,000 professors and 250 employees use our system.</Lang>
          <Lang id="fr">Environ 10 000 étudiants, 1 000 enseignants et 250 employés utilisent notre système.</Lang>
          <Lang id="zh">约有1万名学生、1千名教授和250名员工使用我们的系统。</Lang>
        </Task>
      </Responsibilities>
    </Job>
  </WorkExperience>

  <TechnicalSkills>
    <!-- Cette section peut rester inchangée sauf si on veut traduire chaque élément -->
    <BusinessIntelligence>
      <Tool>Power BI</Tool>
      <Tool>Azure Data Factory</Tool>
      <Tool>SQL</Tool>
    </BusinessIntelligence>
    <ProgrammingLanguages>
      <Language>C</Language>
      <Language>Java</Language>
      <Language>SQL</Language>
      <Language>HTML</Language>
      <Language>CSS</Language>
      <Language>JavaScript</Language>
      <Language>C++</Language>
      <Language>Prolog</Language>
      <Language>Haskell</Language>
    </ProgrammingLanguages>
    <DataManagement>
      <Skill>ETL</Skill>
      <Skill>Database Design</Skill>
      <Skill>Data Visualization</Skill>
    </DataManagement>
    <SoftwareTools>
      <Tool>Microsoft Office (Word, Excel, PowerPoint)</Tool>
      <Tool>Git</Tool>
    </SoftwareTools>
    <OperatingSystems>
      <System>Windows</System>
      <System>Linux</System>
    </OperatingSystems>
  </TechnicalSkills>

  <Languages>
    <Language>
      <Name>English</Name>
      <Level>B2</Level>
      <Certification>Cambridge English Certificate</Certification>
    </Language>
    <Language>
      <Name>French</Name>
      <Level>Native</Level>
    </Language>
  </Languages>

  <Projects>
    <Project image="web_app_movie.png">
      <Title>
        <Lang id="en">Web Application About Movies and Shows</Lang>
        <Lang id="fr">Application web sur les films et séries</Lang>
        <Lang id="zh">关于电影和剧集的网络应用</Lang>
      </Title>
      <Year>2024</Year>
      <Description>
        <Lang id="en">Developed a web application using React and NextJS. Linked to a database with API. Includes responsive design and authentication.</Lang>
        <Lang id="fr">Développement d'une application web avec React et NextJS. Connectée à une base de données via une API. Responsive et avec authentification.</Lang>
        <Lang id="zh">使用React和NextJS开发的Web应用程序。通过API连接数据库。包含响应式设计和身份验证。</Lang>
      </Description>
      <Link>https://projet-pwa-drab.vercel.app/login</Link>
      <LoginInfo>
        <Lang id="en">Login: tomarthour@gmail.com, Password: ebzd</Lang>
        <Lang id="fr">Identifiant : tomarthour@gmail.com, Mot de passe : ebzd</Lang>
        <Lang id="zh">登录：tomarthour@gmail.com，密码：ebzd</Lang>
      </LoginInfo>
    </Project>

    <Project image="web_project.png">
      <Title>
        <Lang id="en">Train Simulator</Lang>
        <Lang id="fr">Simulateur de Train</Lang>
        <Lang id="zh">火车模拟器</Lang>
      </Title>
      <Year>2023</Year>
      <Description>
        <Lang id="en">Developed a top-down game in JavaScript to place blocks on a map and simulate train movement.</Lang>
        <Lang id="fr">Création d’un jeu en vue de dessus avec JavaScript permettant de placer des blocs sur une carte et simuler le déplacement de trains.</Lang>
        <Lang id="zh">用JavaScript开发的俯视图游戏，可在地图上放置模块并模拟列车运行。</Lang>
      </Description>
    </Project>

    <Project>
      <Title>
        <Lang id="en">Access to Documents</Lang>
        <Lang id="fr">Accès aux documents</Lang>
        <Lang id="zh">文档访问</Lang>
      </Title>
      <Year>2023</Year>
      <Description>
        <Lang id="en">Created a web page in JavaScript for administrative staff to access documents.</Lang>
        <Lang id="fr">Création d’une page web en JavaScript pour permettre au personnel administratif d’accéder aux documents.</Lang>
        <Lang id="zh">用JavaScript开发的网页，供行政人员访问文档。</Lang>
      </Description>
    </Project>

    <Project>
      <Title>
        <Lang id="en">Tamagochi Like</Lang>
        <Lang id="fr">Jeu type Tamagotchi</Lang>
        <Lang id="zh">宠物养成游戏</Lang>
      </Title>
      <Year>2023</Year>
      <Description>
        <Lang id="en">Created a graphical version of a Tamagotchi-style game using JavaScript, HTML and CSS.</Lang>
        <Lang id="fr">Création d’un jeu graphique type Tamagotchi avec JavaScript, HTML et CSS.</Lang>
        <Lang id="zh">使用JavaScript、HTML和CSS开发的Tamagotchi风格图形游戏。</Lang>
      </Description>
    </Project>

    <Project>
      <Title>
        <Lang id="en">Window Manager</Lang>
        <Lang id="fr">Gestionnaire de fenêtres</Lang>
        <Lang id="zh">窗口管理器</Lang>
      </Title>
      <Year>2023</Year>
      <Description>